{
  "actor_id": "actor_adult_woman_01",
  "display_name": "Adult Woman Actor 01",
  "template_version": "actor_model_template_v1",
  "readiness_state": "template",
  "age_band": "adult",
  "gender_presentation": "woman",
  "role_range": [
    "lead",
    "support",
    "victim",
    "witness",
    "neighbor",
    "office_worker",
    "mystery_support"
  ],
  "template_goal": {
    "goal_id": "gold_reusable_video_toon_actor_v1",
    "is_primary_template": true,
    "target_actor_id": "actor_adult_woman_01",
    "target_use": "single fixed video-toon actor reusable across packs, episodes, roles, dialogue layers, and thumbnails",
    "reuse_surfaces": [
      "pack_actor_pool",
      "episode_role_casting",
      "scene_variant_selection",
      "mouth_flap_layering",
      "eye_blink_layering",
      "thumbnail_composition",
      "omnibus_role_swap"
    ]
  },
  "reuse_contract": {
    "identity_is_fixed": true,
    "roles_may_change_by_episode": true,
    "background_may_change_by_episode": true,
    "wardrobe_policy": "base_silhouette_locked_pack_overrides_only",
    "allowed_pack_overrides": [
      "small accessory",
      "outerwear color",
      "occupation prop",
      "genre-safe wardrobe detail"
    ],
    "must_not_change": [
      "age band",
      "face shape",
      "hair silhouette",
      "body proportions",
      "primary clothing silhouette",
      "stable voice slot"
    ],
    "requires_asset_coverage_before_render": true
  },
  "identity_lock": {
    "face_shape": "consistent adult Korean woman face shape",
    "hair": "short or medium neat dark hair, fixed per generated actor",
    "body_type": "ordinary adult proportions, half-body video-toon friendly",
    "signature_clothing": "simple modern cardigan or blouse silhouette",
    "must_not_change": [
      "age band",
      "face shape",
      "hair silhouette",
      "body proportions",
      "primary clothing silhouette"
    ]
  },
  "style_contract": {
    "visual_style": "clean Korean webtoon video-toon cutout",
    "line_quality": "clean line art",
    "rendering": "cel-shaded, readable expression",
    "framing": "waist-up or half-body, centered for layered compositing"
  },
  "required_variants": [
    "neutral_standing",
    "talking_standing",
    "blink_standing",
    "happy_standing",
    "sad_standing",
    "angry_standing",
    "worried_standing",
    "scared_standing",
    "neutral_seated",
    "talking_seated"
  ],
  "mouth_shapes": [
    "mouth_closed",
    "mouth_small_open",
    "mouth_wide_open",
    "mouth_round"
  ],
  "eye_shapes": [
    "eyes_open",
    "eyes_closed",
    "eyes_worried",
    "eyes_angry"
  ],
  "layering_contract": {
    "image_format": "png_rgba",
    "canvas": {
      "width": 1024,
      "height": 1536
    },
    "anchor_points": {
      "actor_root": {
        "x": 0.5,
        "y": 0.92
      },
      "head_center": {
        "x": 0.5,
        "y": 0.28
      },
      "eye_center": {
        "x": 0.5,
        "y": 0.25
      },
      "mouth_center": {
        "x": 0.5,
        "y": 0.38
      }
    },
    "layer_order": [
      "variant_base",
      "eye_layer",
      "mouth_layer"
    ],
    "naming_policy": {
      "variant": "variants/{variant_key}.png",
      "mouth_shape": "face_parts/{mouth_shape_key}.png",
      "eye_shape": "face_parts/{eye_shape_key}.png"
    }
  },
  "voice_profile": {
    "recommended_slot": "female_01",
    "stable_voice_required": true
  },
  "public_release_boundary": {
    "contains_real_actor_media": false,
    "contains_voice_samples": false,
    "contains_model_weights": false,
    "contains_private_paths": false
  }
}
